movieId,title,genres,storyline,country,language,director,release_year,runtime,age_rating,tag_1,tag_2,tag_3
168,First Knight (1995),Action|Drama|Romance,"After King Arthur of Camelot has fought several wars which has led to peace and justice for his land, he is turning his attention to thoughts of marriage, his chosen one being Lady Guinevere, who has become head of neighboring Leonesse following the death of her father. Peace and justice for Arthur and Guinevere are short lived as Prince Malagant, one of the knights of the round table, wants Camelot for himself and King Arthur deposed. Many in the land follow Malagant, whose quest also involves marauding Leonesse. As the King's betrothed, Guinevere becomes Malagant's target in achieving both of his goals. Meanwhile, Lancelot is a free-living peasant who often makes his way through life by demonstrations of his sword fighting prowess. His skill is largely due to his ability to assess his opponents, and not fear dying. On Malagant's first attempt at abducting Guinevere, Lancelot, by happenstance, is there to save her. He falls in love with her at first sight. Although attracted to the man who saved her, Guinevere cannot think of any other man in the lead up to her marriage to Arthur. Because of his attraction to Guinevere, Lancelot becomes involved in the battles between Malagant and Arthur in Lancelot doing whatever needed to keep Guinevere safe. As these battles brew and as Arthur becomes indebted to Lancelot for saving Guinevere at the possible expense of his own life, Guinevere cannot help but fall for Lancelot, resulting in a romantic triangle comprised of Arthur, Guinevere and Lancelot, a triangle of which Arthur is unaware. —Huggo",United States,English,Jerry Zucker,1995,2 hours 14 minutes,12,based on legend,love triangle,arthurian legend
169,Free Willy 2: The Adventure Home (1995),Adventure|Children|Drama,"Willy the smart and rebellious whale and Jessie the orphaned boy team up to escape Willy's captivity and horrible owner to get back to his pod. Can they succeed with the help of Annie and Glenn Jessie's foster parents, Randolph the spiritual friend of Willy and Jessie, and Rae Willy's trainer?",France,"English, Danish, Malay, Dutch, Indonesian, Finnish, Luxembourgish, French Sign Language",Dwight H. Little,1995,1 hour 35 minutes,All,whale,boy,oil tanker
170,Hackers (1995),Action|Adventure|Crime|Thriller,"A young boy is arrested by the U.S. Secret Service for writing a computer virus and is banned from using a computer until his 18th birthday. Years later, he and his new-found friends discover a plot to unleash a dangerous computer virus, but they must use their computer skills to find the evidence while being pursued by the Secret Service and the evil computer genius behind the virus. —Wiki",United States,"English, Italian, Spanish, Japanese, Russian",Iain Softley,1995,1 hour 45 minutes,15,computer,computer virus,sexual fantasy
171,Jeffrey (1995),Comedy|Drama,"Jeffrey, a young gay man in New York, decides that sex is too much and decides to become celibate. He immediately meets the man of his dreams and must decide whether or not love is worth the danger of a boyfriend dying. —Trena Cormier <tc691278@condor.bcm.tmc.edu>",United States,English,Christopher Ashley,1995,1 hour 32 minutes,Rated R for strong sexuality and language,new york city,aids,celibacy
172,Johnny Mnemonic (1995),Action|Sci-Fi|Thriller,"In 2021, the whole world is connected by the gigantic Internet, and almost a half of the population is suffering from the Nerve Attenuation Syndrome (NAS).Johnny with an implanted memory chip in his brain was ordered to transport the over loaded information from Beijing to Newark. While Pharmakom Industries supported by Yakuza tries to capture him to get the information back, the Low-tech group led by J-Bone tries to break the missing code to download the cure of NAS which Johnny carries. —Miho Ishimine <mipo@mag.keio.ac.jp>",Canada,"English, Japanese",Robert Longo,1995,1 hour 43 minutes,15,implanted memory,cyberpunk,virtual reality
173,Judge Dredd (1995),Action|Crime|Sci-Fi,"In the year 2139, the Earth has changed into a virtually uninhabitable place called the Cursed Earth. All of the Earth's population have crowded into the cities across the planet, now known as Mega-Cities. The crimes in these Mega-Cities became so violent and so powerful, that the regular justice system was powerless to contain, then it collapsed completely. However, a new justice system came from the ashes, there were three justice systems in one (police, jury and executioner), they were called Judges. In Mega-City One (formerly, New York City), there was a Judge, named Joseph Dredd, who was the toughest and most stringent Judge in history. One day, he was charged with murder, and was tried and sentenced to life in prison because of it. —John Wiggins",United States,English,Danny Cannon,1995,1 hour 36 minutes,15,based on comic book,cult film,judge
174,Jury Duty (1995),Comedy,"When jobless Tommy Collins discovers that sequestered jurors earn free room and board as well as $5-a-day, he gets himself assigned to a jury in a murder trial. Once there, he does everything he can to prolong the trial and deliberations and make the sequestration more comfortable for himself. —Steve Derby <sderby@sdeco.com>",United States,English,John Fortenberry,1995,1 hour 28 minutes,15,jury,hotel,serial killer
175,Kids (1995),Drama,"Summer, New York City, 1995. With his entire existence pivoting around drugs, skateboarding, and his repugnant theory about sex, swaggering 17-year-old layabout Telly lives like there's no tomorrow. Now, a wide-eyed 12-year-old virgin has agreed to have sex with him. But the smooth-talking Casanova is unaware that, in the hunt for the next victim, sex is a weapon. And then, an unsuspecting former lover accidentally discovers she is HIV positive. As the hapless teenager embarks on a pointless, 24-hour mission to track down the pubescent hedonist before another naïve pre-teen virgin falls prey to his unsettling sexual appetite, questions arise. What do girls see in Telly? Is this desperate quest to stop the shameless liar a case of too little, too late? —Nick Riganas",United States,"Spanish, English",Larry Clark,1995,1 hour 31 minutes,15,sexual promiscuity,virgin,swimming in underwear
176,Living in Oblivion (1995),Comedy,This ultimate tribute to all independent filmmakers takes place during one day on the set of a non-budget movie.,United States,English,Tom DiCillo,1995,1 hour 30 minutes,Rated R for strong language,filmmaking,nightmare,dream sequence
177,Lord of Illusions (1995),Horror,"During a routine case in L.A., NY private investigator Harry D'Amour stumbles over members of a fanatic cult, who are waiting for the resurrection of their leader Nix. 13 years ago, Nix was gunned down by his best trainee Swann. In the meantime Swann is advanced to a popular illusionist like David Copperfield and is married to the charming Dorothea. She hires D'Amour to protect Swann against the evil cult members. A short time later Swann is killed by one of his own tricks and the occurrences are turning over, and it crackles between Dorothea and D'Amour. —Sam Beckett <drgr4000@mailszrz.zrz.tu-berlin.de>",United States,English,Clive Barker,1995,1 hour 49 minutes,18,private detective,neo noir,telekinesis
178,Love & Human Remains (1993),Comedy|Drama,"Set in a dreary urban landscape of Edmonton, LOVE AND HUMAN REMAINS is a dark comedy about a group of twentysomethings looking for love and meaning in the '90s. The film focuses on roommates David, a gay waiter who has has given up on his acting career, and Candy, a book reviewer who is also David's ex-lover. David and Candy's lives are entangled with those of David's friends (a busboy, a psychic dominatrix, and a misogynistic civil-servant) and Candy's dates (a male bartender and a lesbian schoolteacher). Meanwhile, a serial killer menaces the concrete and asphalt neighbourhood in which David and Candy live. —Michael Stewart",Canada,English,Denys Arcand,1993,1 hour 40 minutes,18,lesbian,dominatrix,sex
179,Mad Love (1995),Drama|Romance,"High-school student Matt Leland lives with his twin brother and sister and his father in a house by the lake. When teenager Casey Roberts moves into the house on the other side of the lake, Matt snoops into her room with his telescope. They meet and soon they fall in love. One day, Matt is taking a test at school and Casey activates the fire alarm to stop the test. She is suspended and her father decides to check her into a psychiatric institution, but Matt breaks her out of it. They travel in Matt's car and have lots of fun until the day Matt discovers that Casey has bipolar disorder with periods of depression and periods of elevated mood. When she tries to commit suicide, Matt realizes that she needs specialized help. —Claudio Carvalho, Rio de Janeiro, Brazil",United States,English,Antonia Bird,1995,1 hour 33 minutes,15,voyeur,escape from a psychiatric hospital,boyfriend girlfriend relationship
180,Mallrats (1995),Comedy|Romance,"Brodie Bruce, a Sega and comic book obsessed college student, and his best friend, TS Quint, are both dumped by their girlfriends on the same day, and to deal with their loss, they both go to the local mall. Along the way, they meet up with some friends, including Willam, a guy who stares at Magic Eye pictures, desprately trying to see the hidden image; Gwen, one of TS's ex-girlfriends; and Jay & Silent Bob, of Clerks fame. Eventually, they decide to try and win back their significant others, and take care of their respective nemesises (TS's girlfriend's father, and a store clerk who hates the two for not having any shopping agenda). —MTRodaba2468",United States,English,Kevin Smith,1995,1 hour 34 minutes,15,mall,jay and silent bob,dumped by girlfriend
181,Mighty Morphin Power Rangers: The Movie (1995),Action|Children,"Six teenagers Tommy, Kimberly, Adam, Billy, Rocky and Aisha have discovered the power to fight the forces of evil. A giant egg is unearthed in Angel Grove. Lord Zedd and Rita Repulsa investigate the egg, and release the creature inside - Ivan Ooze, whom Zordon had trapped him inside the egg six thousand years ago. Once released, Ooze left to seek revenge on Zordon. And now Zordon in his crystalline deathbed is dying because he has no power, without the power then Zordon of Eltar will never existed. Now the fate of the universe is in their hands. But this time the Power Rangers head for a distant planet to meet up with a bikini-clad warrior babe named Dulcea who imparts ancient wisdom and power. But now that they have their powers back and becomes Power Rangers once more they will now get back to business and defeat Ivan Ooze at all costs. —Anthony Pereyra {hypersonic91@yahoo.com}",United States,English,Bryan Spicer,1995,1 hour 35 minutes,All,hypnotism,alien,meteor
183,Mute Witness (1994),Comedy|Horror|Thriller,"Billy Hughes, a mute make-up artist working on a slasher movie being shot in Moscow, is locked in the studio after hours. While there, she witnesses a brutal murder, and must first escape capture at that time, then keep from being killed before convincing authorities of what she's seen. Plot twists galore follow as Billy tries to stay alive. —James Meek <james@oz.net>",United Kingdom,"English, Russian",Anthony Waller,1995,1 hour 35 minutes,18,mute,chase,russian mafia
184,Nadja (1994),Drama,"This ultra-hip, post-modern vampire tale is set in contemporary New York City. Members of a dysfunctional family of vampires are trying to come to terms with each other, in the wake of their father's death. Meanwhile, they are being hunted by Dr. Van Helsing and his hapless nephew. As in all good vampire movies, forces of love are pitted against forces of destruction. —Tad Dibbern <DIBBERN_D@a1.mscf.upenn.edu>",United States,English,Michael Almereyda,1994,1 hour 33 minutes,"Rated R for some scenes of bizarre vampire sexuality and gore, and for some language",vampire,female vampire,boxing practice
185,"Net, The (1995)",Action|Crime|Thriller,"Angela Bennett is a computer expert. This young and beautiful analyst is never far from a computer and modem. The only activity she has outside of computers is visiting her mother. A friend, whom she's only spoken to over the net and phone, Dale Hessman, sent her a program with a weird glitch for her to de-bug. That night, he left to meet her and was killed in a plane crash. Angela discovers secret information on the disk she has received only hours before she leaves for vacation. Her life then turns into a nightmare, her records are erased from existence and she is given a new identity, one with a police record. She struggles to find out why this has happened and who has it in for her. —Official DVD cover",United States,"English, Spanish",Irwin Winkler,1995,1 hour 54 minutes,15,computer,identity,identity theft
186,Nine Months (1995),Comedy|Romance,"Samuels life is perfect. That is, until he finds out his girlfriend is pregnant. Now he must face the issues that come with being an expecting father, in a most entertaining way. —Anonymous",United States,"English, Russian",Chris Columbus,1995,1 hour 43 minutes,15,time for title,bad dream,close up of eyes
187,Party Girl (1995),Comedy,"Mary is a free-spirited young woman with a run-down New York apartment and a high fashion wardrobe. She calls her godmother, a librarian, for bail money after being arrested for throwing an illegal party. To repay the loan, she begins working as a library clerk. At first she hates it, but when challenged decides to master the Dewey Decimal System and become a great library clerk, while romancing a falafel vendor and helping her roommate in his goal to become a professional DJ. —James Meek <james@oz.net>",United States,"English, Arabic",Daisy von Scherler Mayer,1995,1 hour 34 minutes,Rated R for language and drug content,nightclub,library,party
188,"Prophecy, The (1995)",Fantasy|Horror|Mystery,"At the scene of a bizarre murder, L.A. homicide detective Thomas Dagget discovers a lethal heavenly prophecy now being fulfilled on earth. Yet in his fight to stop the forces of evil, led by the powerful angel Gabriel, Dagget finds an unlikely ally in an elementary school teacher. Together they race against time and terror to save the world as we know it.",United States,"English, Spanish, Latin",Gregory Widen,1995,1 hour 38 minutes,15,angel,scene of the crime,heaven
189,Reckless (1995),Comedy|Fantasy,"On Christmas Eve, a regretful husband admits to his high-spirited wife that he has hired a contract killer to take her out. She immediately flees. A nice couple offers her shelter, but everyone have dark secrets in this wacky movie.",United States,English,Norman René,1995,1 hour 31 minutes,Rated PG-13 for complex psychological themes and some disturbing images,screenplay adapted by author,christmas,female protagonist
190,Safe (1995),Thriller,"""Safe"" has been described as a horror movie of the soul, a description that director Todd Haynes relishes. California housewife Carol White seems to have it all in life: a wealthy husband, a beautiful house, servants, beauty, and a lot of friends. The only thing she lacks is a strong personality: Carol seems timid and empty during all of her interactions with the world around her. At the beginning of the film, one would consider her to be more safe in life than just about anyone. That doesn't turn out to be the case. Starting with headaches and leading to a grandmal seizure, Carol becomes more and more sick, claiming that she's become sensitive to the common toxins in today's world: exhaust, fumes, aerosol spray, etc. She pulls back from the sexual advances of her husband and spends her nights alone by the TV or wandering around the outside of her well-protected home like an animal in a cage. Her physician examines her and can find nothing wrong. An allergist finds that she has an allergic reaction to milk but explains that there is no treatment for that sort of allergy. She sees a psychiatrist who does nothing but make her nervous. In the hospital, Carol sees an infomercial for Wrenwood, a new-age retreat for those who are ""environmentally ill,"" and leaves her husband and stepson to try and find salvation at this retreat: headed by a phony, grandstanding, ""sensitive"" individual named Peter Dunning. —David Eschatfische <esch@fische.com>",United States,"English, Spanish",Todd Haynes,1995,1 hour 59 minutes,Rated R for a sex scene and brief language,psychiatrist,housewife,allergy
191,"Scarlet Letter, The (1995)",Drama|Romance,"In 1666 in the Massachusetts Bay colony, Puritans and the Algonquian have an uneasy truce. Hester Prynne (Demi Moore) arrives from England, seeking independence. Awaiting her husband, she establishes independence, fixing up a house, befriending Quakers and other outsiders. Passion draws her to the young pastor, Reverend Arthur Dimmesdale (Gary Oldman). He feels the same; when they learn her husband has probably died at the hands of Indians, they consummate their love. A child is born, and on the day Hester is publicly humiliated and made to wear a scarlet letter, her husband appears after a year with Indians. Calling himself Chillingworth (Robert Duvall), he seeks revenge, searching out Hester's lover and stirring fears of witchcraft. Will his murderous plot succeed? —<jhailey@hotmail.com>",United States,English,Roland Joffé,1995,2 hours 15 minutes,18,17th century,adultery,the letter a
193,Showgirls (1995),Drama,"All alone in the world, Nomi Malone, making her way to Las Vegas, is determined to make a name as a dancer while putting her unspoken past behind her. Her tough, streetwise veneer is not as infallible as she would like, and as she arrives in Vegas she becomes more cautious about approaching strangers who seem willing to help her purely out of the goodness of their hearts. Her talent and connections in combination are only able to get her a job at the Cheetah Club, a strip joint. Her first true friend in Vegas, Molly Abrams, works as the costumer for Goddess, the topless production at the Stardust. It is through Molly that Nomi catches the eye of Goddess' headliner, Cristal Connors. Nomi has a love/hate feeling toward Cristal: she doesn't much like her but wants to become her. Being at the Stardust, Nomi also catches the eye of Cristal's boyfriend, Zack Carey, Stardust's entertainment director. Through these contacts, Nomi is presented opportunity after opportunity to be part of the Stardust/Goddess family. She has to decide how far she will go to achieve her dream. James Smith, a struggling dancer/choreographer who works whatever odd jobs he can get and who is also attracted to Nomi largely for her natural albeit very raw talent, doesn't see Nomi's chosen path as the one she should pursue as he considers Goddess illegitimate: while the Cheetah is what it appears on the surface, Goddess is the Cheetah hiding behind its big name. Through it all, Nomi discovers the good, the bad, and the very bad about Vegas life, especially among the rich and beautiful. —Huggo",France,English,Paul Verhoeven,1995,2 hours 8 minutes,18,lap dancing,striptease,rape
194,Smoke (1995),Comedy|Drama,"The plot of this movie, like smoke, drifts and swirls ethereally. Characters and subplots are deftly woven into a tapestry of stories and pictures which only slowly emerges to our view. This movie tries to convince us that reality doesn't matter so much as aesthetic satisfaction. In Auggie Wren's (Harvey Keitel's) New York City smoke shop, day by day passes, seemingly unchanging until he teaches us to notice the little details of life. Paul Benjamin (William Hurt), a disheartened and broken writer, has a brush with death that is pivotal and sets up an unlikely series of events that afford him a novel glimpse into the life on the street which he saw, but did not truly perceive, every day. Finally, it's Auggie's turn to spin a tale. —Tad Dibbern <DIBBERN_D@a1.mscf.upenn.edu>",Germany,English,Wayne Wang,1995,1 hour 52 minutes,All,summer,five chapters,novelist
195,Something to Talk About (1995),Comedy|Drama|Romance,"Grace Bichon, who is managing her father Wyly King's riding-stable, discovers that her husband, Eddie, deceives her with another woman. After confronting him in the middle of the night on the streets of their small home town, she decides to stay at her sister Emma Rae's house for a while to make up her mind. Breaking out of her everyday life, she starts to question everyone's authority, especially Wyly's, thus causing a stir in her parents' marriage, too. —Thomas Meyer <i03a@zfn.uni-bremen.de>",United States,English,Lasse Hallström,1995,1 hour 46 minutes,15,adulterous husband,female protagonist,reconciliation
196,Species (1995),Horror|Sci-Fi,"In 1993, a search for extraterrestrial life, a transmission's received, detailing an alien DNA structure, along with instructions on how to splice it with human DNA. The result is Sil, a sensual but deadly creature who can change from a beautiful woman to an armor-plated killing machine in the blink of an eye. Government agent Xavier Fitch assembles a team of scientists and mercenaries to locate and destroy Sil before she manages to find a mate and breed. —Amazon",United States,English,Roger Donaldson,1995,1 hour 48 minutes,18,undressing,interspecies sex,sex with an alien woman
198,Strange Days (1995),Action|Crime|Drama|Mystery|Sci-Fi|Thriller,"In 1999, Los Angeles is racial war zone with the army and LSPD and SWAT officers fighting Afro-American people. The former cop Lenny Nero is a dealer of illegal recording in CDs that gives the memories and sensations of the recorder to the user. He buys the recordings from the supplier Tick; he misses his former mistress Faith, who was a hooker and now is a singer; his best friend is the private eye Max Peltier and the limousine driver Lornette 'Mace' Mason, who has unrequited love for him. Two days before the turn of the century, the black rapper Jeriko One is murdered. The hooker Iris seeks Lenny out but there is an incident and they do not talk to each other. However she drops a recording into Lenny's car while he unsuccessfully tries to meet Faith at a night-club. However her boyfriend Philo Gant does not let them talk. When Lenny learns that Iris was sadistically raped and killed, he gets involved in a sick scheme and discovers dirty hidden secrets. —Claudio Carvalho, Rio de Janeiro, Brazil",United States,English,Kathryn Bigelow,1995,2 hours 25 minutes,18,cyberpunk,virtual reality,uprising
199,"Umbrellas of Cherbourg, The (Parapluies de Cherbourg, Les) (1964)",Drama|Musical|Romance,"16-year-old Genevieve and 20-year-old Guy are very much in love. Her kind mother, who runs an umbrella shop, won't hear of her marrying, particularly as Guy has yet to complete his compulsory military service. Genevieve is heartbroken when he leaves for his army service in colonial Algeria and is upset to have received only one letter from him in two months. Her mother's solution to this situation is kind diamond-merchant Roland Cassard, who has helped them in the past. —garykmcd",France,"French, English",Jacques Demy,1964,1 hour 31 minutes,12,shop,auto mechanic,cherbourg normandy
201,Three Wishes (1995),Drama|Fantasy,"When Jane Holman is driving with her two sons, Tom and Gunny, she accidentally runs into a drifter, named Jack McCloud, who breaks his leg. Feeling sorry for him, Jane invites Jack and his dog Betty Jane to stay at her house until his leg has healed. After having some difficulties to adapt to this new lifestyle, Jack soon finds himself loved by the family and they all want him to stay. When he starts teaching baseball to Tom, who misses his father who's missing in the Korean War, the two of them develop a strong bond. Meanwhile, Gunny believes that there's more to Jack and Betty Jane than meets the eye, and he's determined to find out. —Peter Huiskes <huiskes@westbrabant.net>",United States,English,Martha Coolidge,1995,1 hour 55 minutes,All,drifter,baseball,flying boy
202,Total Eclipse (1995),Drama|Romance,"In 1871, Paul Verlaine (1844-1896), an established poet, invites boy genius Arthur Rimbaud (1854-1891) to live with Paul and his young pregnant wife, Mathiltde, in her father's home in Paris. Rimbaud's uncouth behavior disrupts the household as well as the insular society of French poets, but Verlaine finds the youth invigorating. Stewed in absinthe and resentment, Verlaine abuses Mathiltde; he and Rimbaud become lovers and abandon her. There are reconciliations and partings with Mathiltde and partings and reconciliations with Rimbaud, until an 1873 incident with a pistol sends one of them to prison. Codas dramatize the poets' final meeting and last illnesses. —<jhailey@hotmail.com>",United Kingdom,English,Agnieszka Holland,1995,1 hour 51 minutes,18,1870s,male nudity,poet
