movieId,title,genres,storyline,country,language,director,release_year,runtime,age_rating,tag_1,tag_2,tag_3
1,Toy Story (1995),Adventure|Animation|Children|Comedy|Fantasy,"A little boy named Andy loves to be in his room, playing with his toys, especially his doll named ""Woody"". But, what do the toys do when Andy is not with them, they come to life. Woody believes that his life (as a toy) is good. However, he must worry about Andy's family moving, and what Woody does not know is about Andy's birthday party. Woody does not realize that Andy's mother gave him an action figure known as Buzz Lightyear, who does not believe that he is a toy, and quickly becomes Andy's new favorite toy. Woody, who is now consumed with jealousy, tries to get rid of Buzz. Then, both Woody and Buzz are now lost. They must find a way to get back to Andy before he moves without them, but they will have to pass through a ruthless toy killer, Sid Phillips. —John Wiggins",United States,English,John Lasseter,1995,1 hour 21 minutes,All,toy,toy comes to life,rivalry
2,Jumanji (1995),Adventure|Children|Fantasy,"Jumanji, one of the most unique--and dangerous--board games ever, falls into the hands of the curious teen, Alan Parrish, in 1969. Mysterious and magical, the game strands the unsuspecting boy in the lush, savage forests of a mythical realm. Nearly three decades later, the game releases him before the awed eyes of the young orphaned siblings, Judy and Peter Shepherd. Now, the wild and incessant beat of the jungle's tribal drums is calling for the now-adult Alan and the other hesitant players, as the one who rolls the dice must never leave undone what the roll has started. Has anyone ever escaped from the game and Jumanji's formidable foes? —Nick Riganas",United States,"English, French",Joe Johnston,1995,1 hour 44 minutes,All,board game,trapped in a game,adventurer
3,Grumpier Old Men (1995),Comedy|Romance,"Things don't seem to change much in Wabasha County: Max and John are still fighting after 35 years, Grandpa still drinks, smokes, and chases women , and nobody's been able to catch the fabled ""Catfish Hunter"", a gigantic catfish that actually smiles at fishermen who try to snare it. Six months ago John married the new girl in town (Ariel), and people begin to suspect that Max might be missing something similar in his life. The only joy Max claims is left in his life is fishing, but that might change with the new owner of the bait shop. —Murray Chapman <muzzle@cs.uq.oz.au>",United States,"English, Italian, German",Howard Deutch,1995,1 hour 41 minutes,15,sequel,boat,lake
4,Waiting to Exhale (1995),Comedy|Drama|Romance,"This story based on the best selling novel by Terry McMillan follows the lives of four African-American women as they try to deal with their very lives. Friendship becomes the strongest bond between these women as men, careers, and families take them in different directions. Often light-hearted this movie speaks about some of the problems and struggles the modern women face in today's world. —David Adrine <hdadrine@hotmail.com>",United States,English,Forest Whitaker,1995,2 hours 4 minutes,18,black american,friendship between women,husband wife relationship
5,Father of the Bride Part II (1995),Comedy,"In this sequel to ""Father of the Bride"", George Banks must accept the reality of what his daughter's ascension from daughter to wife, and now to mother means when placed into perspective against his own stage of life. As the comfortable family unit starts to unravel in his mind, a rapid progression into mid-life crisis is in his future. His journey to regain his youth acts as a catalyst for a kind of ""rebirth"" of his attitude on life when he and his wife, Nina, find how their lives are about to change as well. —Scott Jentsch",United States,English,Charles Shyer,1995,1 hour 46 minutes,All,fatherhood,doberman,dog
6,Heat (1995),Action|Crime|Thriller,"Hunters and their prey--Neil and his professional criminal crew hunt to score big money targets (banks, vaults, armored cars) and are, in turn, hunted by Lt. Vincent Hanna and his team of cops in the Robbery/Homicide police division. A botched job puts Hanna onto their trail while they regroup and try to put together one last big 'retirement' score. Neil and Vincent are similar in many ways, including their troubled personal lives. At a crucial moment in his life, Neil disobeys the dictum taught to him long ago by his criminal mentor--'Never have anything in your life that you can't walk out on in thirty seconds flat, if you spot the heat coming around the corner'--as he falls in love. Thus the stage is set for the suspenseful ending.... —Tad Dibbern <DIBBERN_D@a1.mscf.upenn.edu>",United States,"English, Spanish",Michael Mann,1995,2 hours 50 minutes,18,gun battle,armored car robbery,gunfight
7,Sabrina (1995),Comedy|Romance,"While she was growing up, Sabrina Fairchild spent more time perched in a tree watching the Larrabee family than she ever did on solid ground. As the chauffeur's daughter on their lavish Long Island estate, Sabrina was invisible behind the branches, but she knew them all below - There is Maude Larrabee, the modern matriarch of the Larrabee Corporation; Linus Larrabee, the serious older son who expanded a successful family business into the world's largest communications company; and David, the handsome, fun-loving Larrabee, who was the center of Sabrina's world until she was shipped off to Paris. After two years on the staff of Vogue magazine, Sabrina has returned to the Larrabee estate but now she has blossomed into a beautiful and sophisticated woman. And she's standing in the way of a billion dollar deal. —Official DVD cover",Germany,"English, French",Sydney Pollack,1995,2 hours 7 minutes,15,character name as title,car,british car
8,Tom and Huck (1995),Adventure|Children,"Tom Sawyer is a mischievous young boy, growing up in a small US town in the mid-1800s. He finds a friend in Huckleberry Finn, a vagrant and outcast, and the two get up to all sorts of boyish adventures. While on one of these adventures they witness a murder, leaving Tom with a dilemma. —grantss",United States,English,Peter Hewitt,1995,1 hour 37 minutes,All,huckleberry finn character,becky thatcher character,boy
9,Sudden Death (1995),Action,"Darren McCord takes his two kids to a Pittsburgh Penguins National Hockey League play-off game, unknowing that the sports arena has been taken over by terrorists, who are holding the Vice President of the United States, as well as many other high-ranking officials hostage. Darren later becomes the only one who is aware of the situation. And, the stakes are raised when the terrorists announce that they will blow-up the building at the end of the game. Therefore, Darren must not only subdue the terrorists, but postpone the game and send it to overtime. —Anonymous",United States,English,Peter Hyams,1995,1 hour 51 minutes,18,ice hockey,hockey,death in title
10,GoldenEye (1995),Action|Adventure|Thriller,"When a deadly satellite weapon system falls into the wrong hands, only Agent James Bond 007 can save the world from certain disaster. Armed with his license to kill, Bond races to Russia in search of the stolen access codes for ""GoldenEye"", an awesome space weapon that can fire a devastating electromagnetic pulse toward Earth. But 007 is up against an enemy who anticipates his every move: a mastermind motivated by years of simmering hatred. Bond also squares off against Xenia Onatopp, an assassin who uses pleasure as her ultimate weapon. —Official Synopsis",United Kingdom,"English, Russian, Spanish",Martin Campbell,1995,2 hours 10 minutes,15,official james bond series,official bond film,british secret service
11,"American President, The (1995)",Comedy|Drama|Romance,"Andrew Shepherd is approaching the end of his first term as President of the United States. He's a widower with a young daughter and has proved to be popular with the public. His election seems assured. That is until he meets Sydney Ellen Wade, a paid political activist working for an environmental lobby group. He's immediately smitten with her and after several amusing attempts, they finally manage to go on a date (which happens to be a State dinner for the visiting President of France). His relationship with Wade opens the door for his prime political opponent, Senator Bob Rumson, to launch an attack on the President's character, something he could not do in the previous election as Shepherd's wife had only recently died. —garykmcd",United States,"English, French, Spanish",Rob Reiner,1995,1 hour 54 minutes,15,president,politics,christmas
12,Dracula: Dead and Loving It (1995),Comedy|Horror,"Another spoof from the mind of Mel Brooks. This time he's out to poke fun at the Dracula myth. Basically, he took ""Bram Stoker's Dracula,"" gave it a new cast and a new script and made a big joke out of it. The usual, rich English are attacked by Dracula and Dr. Van Helsing is brought in to save the day. —Jason Ihle <jrihl@conncoll.edu>",France,"English, German",Mel Brooks,1995,1 hour 28 minutes,15,vampire,insane asylum,jonathan harker character
13,Balto (1995),Adventure|Animation|Children,"A half-wolf, half-husky named Balto gets a chance to become a hero when an outbreak of diphtheria threatens the children of Nome, Alaska in the winter of 1925. He leads a dog team on a 600-mile trip across the Alaskan wilderness to get medical supplies. The film is based on a true story which inspired the Iditarod dog sled race. —Alan Katz",United States,English,Simon Wells,1995,1 hour 18 minutes,All,dog,nome alaska,alaska
14,Nixon (1995),Drama,"Writer, Producer, and Director Oliver Stone's exploration of former President Richard Nixon's strict Quaker upbringing, his nascent political strivings in law school, and his strangely self-effacing courtship of his wife, Pat (Joan Allen). The contradictions in his character are revealed early, in the vicious campaign against Helen Gahagan Douglas and the oddly masochistic Checkers speech. His defeat at the hands of the hated and envied John F. Kennedy in the 1960 presidential election, followed by the loss of the 1962 California gubernatorial race, seem to signal the end of his career. Yet, although wholly lacking in charisma, Nixon remains a brilliant political operator, seizing the opportunity provided by the backlash against the antiwar movement to take the Presidency in 1968. It is only when safely in office, running far ahead in the polls for the 1972 Presidential election, that his growing paranoia comes to full flower, triggering the Watergate scandal. —alfiehitchie",United States,"English, Mandarin, Russian",Oliver Stone,1995,3 hours 12 minutes,15,american politics,political leader,year 1972
15,Cutthroat Island (1995),Action|Adventure|Romance,"Morgan Adams and her slave, William Shaw, are on a quest to recover the three portions of a treasure map. Unfortunately, the final portion is held by her murderous uncle, Dawg. Her crew is skeptical of her leadership abilities, so she must complete her quest before they mutiny against her. This is made yet more difficult by the efforts of the British crown to end her piratical raids. —Stern",United States,"English, Spanish, Latin, French",Renny Harlin,1995,2 hours 4 minutes,12,treasure,pirate,pirate ship
16,Casino (1995),Crime|Drama,"This Martin Scorsese film depicts the Janus-like quality of Las Vegas--it has a glittering, glamorous face, as well as a brutal, cruel one. Ace Rothstein and Nicky Santoro, mobsters who move to Las Vegas to make their mark, live and work in this paradoxical world. Seen through their eyes, each as a foil to the other, the details of mob involvement in the casinos of the 1970s and '80s are revealed. Ace is the smooth operator of the Tangiers casino, while Nicky is his boyhood friend and tough strongman, robbing and shaking down the locals. However, they each have a tragic flaw--Ace falls in love with a hustler, Ginger, and Nicky falls into an ever-deepening spiral of drugs and violence. —Tad Dibbern <DIBBERN_D@a1.mscf.upenn.edu>",United States,English,Martin Scorsese,1995,2 hours 58 minutes,18,crime epic,mafia,gambling
17,Sense and Sensibility (1995),Drama|Romance,"When Mr. Dashwood (Tom Wilkinson) dies, he must leave the bulk of his estate to the son by his first marriage, which leaves his second wife and their three daughters Elinor (Dame Emma Thompson), Marianne (Kate Winslet), and Margaret (Emilie François), in straitened circumstances. They are taken in by a kindly cousin, but their lack of fortune affects the marriageability of practical Elinor and romantic Marianne. When Elinor forms an attachment for the wealthy Edward Ferrars (Hugh Grant), his family disapproves and separates them. And though Mrs. Jennings (Elizabeth Spriggs) tries to match the worthy (and rich) Colonel Brandon (Alan Rickman) to her, Marianne finds the dashing and fiery John Willoughby (Greg Wise) more to her taste. Both relationships are sorely tried. —Kathy Li",United States,"English, French",Ang Lee,1995,2 hours 16 minutes,15,based on novel,visit,title same as book
18,Four Rooms (1995),Comedy,"This movie features the collaborative directorial efforts of four new filmmakers, each of whom directs a segment of this comedy. It's New Year's Eve at the Mon Signor Hotel, a former grand old Hollywood hotel, now fallen upon hard times. Often using physical comedy and sight gags, this movie chronicles the slapstick misadventures of Ted, the Bellhop. He's on his first night on the job, when he's asked to help out a coven of witches in the Honeymoon Suite. Things only get worse when he delivers ice to the wrong room and ends up in a domestic argument at a really bad time. Next, he foolishly agrees to watch a gangster's kids for him while he's away. Finally, he finishes off the night refereeing a ghastly wager. —Tad Dibbern <DIBBERN_D@a1.mscf.upenn.edu>",United States,English,Allison Anders,1995,1 hour 38 minutes,18,neo screwball comedy,anthology film,semen
19,Ace Ventura: When Nature Calls (1995),Comedy,"Ace Ventura, emerging from self-imposed exile in a remote Himalayan hideaway, travels to Africa with explorer Fulton Greenwall to find a sacred bat which is told will avert a war between with Wachootoo and Wachati tribes. Of course, when Ace gets involved, all hell breaks loose... —Jonathan Broxton <j.w.broxton@sheffield.ac.uk>",United States,English,Steve Oedekerk,1995,1 hour 30 minutes,All,guano,kidnapping,caught masturbating
20,Money Train (1995),Action|Comedy|Crime|Drama|Thriller,"Two foster brothers work as transit cops. While one's life is as good as it gets, the other's is a pit. After losing his job, getting dumped by his brother, and getting the crap kicked out of him by a loan shark for the umpteenth time, He implements his plan to steal the ""money train,"" a train carrying the New York Subway's weekly revenue. But when things go awry, will his brother be able to save him in time? —A CIA operative",United States,English,Joseph Ruben,1995,1 hour 50 minutes,15,train,new year's eve,subway station
21,Get Shorty (1995),Comedy|Crime|Thriller,"Some guys get all the luck, whether they like it or not. Chili Palmer happens to be in Hollywood collecting a gambling debt when he's struck by lightning (not literally). Called a natural for the movie business, he's snagged up by a producer. The rest is history. —Joshua Davis <xtnb64a@prodigy.com>",United States,English,Barry Sonnenfeld,1995,1 hour 45 minutes,15,loan shark,debt,movie business
22,Copycat (1995),Crime|Drama|Horror|Mystery|Thriller,"In San Francisco, the criminal psychologist Helen Hudson is specialized in serial-killers. During a trial, the accused Daryll Lee Cullum kills a police officer and tries to kill her and she becomes agoraphobic. Now Helen lives a reclusive life with her gay friend Andy that helps her. Sometime later, there is a wave of crimes and Detectives M.J. Monahan and Reuben Goetz are investigating the murder cases. Helen identifies that the murderer is copycatting notorious serial-killers and she anonymously contacts the Police Department. After fourteen phone calls, she is identified by the police. Detectives M.J. and Reuben visit her and Helen teams up with them and prepares the profile of the killer that wants to be famous. But soon the copycat killer Peter Foley contacts and stalks Helen and M.J. and Reuben give protection to her. Will they be capable to stop Foley before the next murder? —Claudio Carvalho, Rio de Janeiro, Brazil",United States,English,Jon Amiel,1995,2 hours 3 minutes,18,serial killer,copycat killer,copycat murder
23,Assassins (1995),Action|Crime|Thriller,"Robert Rath is a seasoned hitman who just wants out of the business with no back talk. But, as things go, it ain't so easy. A younger, peppier assassin named Bain is having a field day trying to kill said older assassin. Rath teams up with a computer hacker named Electra to defeat the obsessed Bain. —Joshua Davis <xtnb64a@prodigy.com>",France,"English, Dutch, Spanish",Richard Donner,1995,2 hours 13 minutes,18,assassin,rival,gun fu
24,Powder (1995),Drama|Sci-Fi,"When sheriff Barnum investigates the death of an elderly rural resident, he discovers a teenage grandson living in the basement. Raised by his grandparents, he has experienced the world only through books, never leaving the family farm. He is sent to a state home for boys where he has trouble fitting in socially. His odd appearance and unusual abilities cause the small town residents to fear and ridicule him. However, not all are afraid. Some begin to view his potential and gifts with wonderment. —Robert B. Young <youngb@tastemaker.com>",United States,English,Victor Salva,1995,1 hour 51 minutes,"Rated PG-13 for intense, sometimes frightening elements of theme, and for language",albino,electricity,loneliness
25,Leaving Las Vegas (1995),Drama|Romance,"Because his wife left him and took his son with her, screenwriter Ben Sanderson has started drinking, a lot. He's getting more and more isolated and he troubles women in bars because he wants to have sex with them. When he gets fired, he decides to leave everything behind and move to Las Vegas and drink himself to death. In Las Vegas he meets Sera, a prostitute with some problems as well who he moves in with. —Marco van Hoof <k_luifje7@hotmail.com>",United States,"English, Russian",Mike Figgis,1995,1 hour 51 minutes,18,prostitute,falling in love with a prostitute,based on novel
26,Othello (1995),Drama,"Iago convinces Othello, The Moor of Venice that his wife, Desdemona has been unfaithful. Iago is an evil, manipulative character with his own agenda. A plot of jealousy and rage transpires in this classic Shakespearean tale. —Jason Ihle <jrihl@conncoll.edu>",United States,English,Oliver Parker,1995,2 hours 3 minutes,Rated R for some sexuality,jealousy,shakespeare play,conspiracy
27,Now and Then (1995),Children|Drama,"Four childhood friends, who are now in their thirties, are having a reunion. Their lives have gone separate and very different ways. Together again, they reminisce about their younger years, especially the eventful period when they were 12. —grantss",United States,English,Lesli Linka Glatter,1995,1 hour 42 minutes,15,1970s,1990s,year 1991
28,Persuasion (1995),Drama|Romance,"Eight years ago, Anne Elliot rejected Frederick Wentworth, the man she loved, out of a sense of duty and obedience. Now an ignored and faded spinster, she follows her financially stricken family from their home, only to be reintroduced to the now successful and wealthy Captain Frederick Wentworth. With their roles reversed and Captain Wentworth the eligible and wealthy bachelor, Anne navigates the scheming society that still tries to keep them apart.",United Kingdom,English,Roger Michell,1995,1 hour 47 minutes,Rated PG for brief mild language,lovers,captain's cabin,water
29,"City of Lost Children, The (Cité des enfants perdus, La) (1995)",Adventure|Drama|Fantasy|Mystery|Sci-Fi,"Set in a dystopian society, someone is kidnapping the children. Krank and his band of clones are using the children to harvest their dreams. Then they kidnap Denree, the brother of One, a fairground strongman. One sets out to find his brother. —grantss",France,"French, Cantonese",Marc Caro,1995,1 hour 52 minutes,15,steampunk fantasy,steampunk sci fi,orphanage
30,Shanghai Triad (Yao a yao yao dao waipo qiao) (1995),Crime|Drama,"Uncle Liu brings his cousin to Shanghai to work for 'Boss,' the leader of a powerful drug empire in the 1930's. Shuisheng, a simple country boy is awed and overwhelmed by the opulence and immense wealth he is suddenly surrounded by. He is to be the attendant of Xiao Jingbao, the new mistress of 'Boss.' While he fumbles with the demands of his new role, much intrigue is going on around him, well beyond his bewildered perception. Xiao Jingbao is having a tumultuous affair, Fat Yu is starting a gang war, and 'Boss' is beginning to suspect that one of his trusted men is not loyal. —Tad Dibbern <DIBBERN_D@a1.mscf.upenn.edu>",France,Mandarin,Yimou Zhang,1995,1 hour 48 minutes,18,boy,1930s,
31,Dangerous Minds (1995),Drama,"Louanne Johnson is an ex-marine, hired as a teacher in a high-school in a poor area of the city. She has recently separated from her husband. Her friend, also teacher in the school, got the temporary job for her. After a terrible reception from the students, she tries unconventional methods of teaching (using karate, Bob Dylan lyrics etc) to gain the trust of the students. —Claudio Carvalho, Rio de Janeiro, Brazil",United States,English,John N. Smith,1995,1 hour 39 minutes,15,teacher student relationship,ex marine,pregnancy
32,Twelve Monkeys (a.k.a. 12 Monkeys) (1995),Mystery|Sci-Fi|Thriller,"James Cole, a prisoner of the state in the year 2035, can earn parole if he agrees to travel back in time and thwart a devastating plague. The virus has wiped out most of the Earth's population and the remainder live underground because the air is poisonous. Returning to the year 1990, six years before the start of the plague, Cole is soon imprisoned in a psychiatric facility because his warnings sound like mad ravings. There he meets a scientist named Dr. Kathryn Railly and Jeffrey Goines, the mad son of an eminent virologist. Cole is returned by the authorities to the year 2035, and finally ends up at his intended destination in 1996. He kidnaps Dr. Railly in order to enlist her help in his quest. Cole discovers graffiti by an apparent animal rights group called the Army of the Twelve Monkeys, but as he delves into the mystery, he hears voices, loses his bearings, and doubts his own sanity. He must figure out if Goines, who seems to be a raving lunatic, holds the key to the puzzle.",United States,"English, French, Latin, Spanish",Terry Gilliam,1995,2 hours 9 minutes,15,time travel,virus,plague
34,Babe (1995),Children|Drama,"Gentle farmer Arthur Hoggett wins a piglet named Babe at a county fair. Narrowly escaping his fate as Christmas dinner when Farmer Hoggett decides to show him at the next fair, Babe bonds with motherly border collie Fly and discovers that he can herd sheep too. But will the other farm animals, including Fly's jealous husband, Rex, accept a pig who doesn't conform to the farm's social hierarchy? —Jwelch5742",Australia,English,Chris Noonan,1995,1 hour 31 minutes,All,pig,sheep,farm
36,Dead Man Walking (1995),Crime|Drama,"A convicted murderer on Death Row and the nun who befriends him. Through the portrayal of finely drawn characters and their interactions as the days, hours, and minutes tick down to the condemned man's execution, powerful emotions are unleashed. While Matthew Poncelet and Sister Prejean desperately try to gain a stay of execution from the governor or the courts, scenes are intercut from the brutal crime, gradually revealing the truth about the events that transpired. In addition to her temporal help, the nun also tries to reach out spiritually and assist as a guide to salvation. —Tad Dibbern <DIBBERN_D@a1.mscf.upenn.edu>",United Kingdom,English,Tim Robbins,1995,2 hours 2 minutes,15,nun,f rated,execution
38,It Takes Two (1995),Children|Comedy,"A rich girl named Alyssa and an orphan named Amanda are two little girls who are identical, but complete strangers who accidentally meet one day. Together they form a plan to try getting Alyssa's father, Roger, to prevent making the biggest mistake of his life: marrying an awful woman named Clarisse. —Aaron Saltzer",United States,English,Andy Tennant,1995,1 hour 41 minutes,All,mistaken identity,identity swapping,nylon stockings
39,Clueless (1995),Comedy|Romance,"Cher, a high school student in Beverly Hills, must survive the ups and downs of adolescent life. Her external demeanor at first seems superficial, but rather it hides her wit, charm, and intelligence which help her to deal with relationships, friends, family, school, and the all-important teenage social life. —Michael Kaminsky <kaminsky@ucsee.eecs.berkeley.edu>",United States,"English, Spanish",Amy Heckerling,1995,1 hour 37 minutes,12,high school,popularity,los angeles california
40,"Cry, the Beloved Country (1995)",Drama,"South African church minister Steven Kumalo is summoned from his village to Johannesburg. There he finds that his son Absolom has been jailed in connection with a robbery in which a white man was killed. The father of the white man, James Jarvis, is a supporter of apartheid, the separation of the races which is the law of South Africa. When they encounter each other, both Kumalo and Jarvis come to unexpected realizations not only about their sons, but about the nature of their own humanity. —Jim Beaver <jumblejim@prodigy.net>",South Africa,English,Darrell Roodt,1995,1 hour 46 minutes,Rated PG-13 for emotional thematic elements and brief language,1940s,racial tension,apartheid
