movieId,title,genres,storyline,country,language,director,release_year,runtime,age_rating,tag_1,tag_2,tag_3
405,Highlander III: The Sorcerer (a.k.a. Highlander: The Final Dimension) (1994),Action|Fantasy,"The third Highlander movie takes place at 1994, which means it's a prequel of the second film. After the death of his beloved wife Heather some centuries ago, Connor MacLeod left the highlands of Scotland and wandered around the world. Finally, he got to Japan, where he met the famous sorcerer Nakano, who was an Immortal too. Soon, they became friends, and Nakano taught Conor some tricks. But one day, an old enemy, Kane, came to Japan willing to find Nakano's cave and kill him. Although he succeeded, after cutting Nakano's head the mountain collapsed and Kane was trapped. Now, centuries after, an excavation reveals Nakano's cave... —Chris Makrozahopoulos <makzax@hotmail.com>",United Kingdom,English,Andrew Morahan,1994,1 hour 39 minutes,18,,,
406,Federal Hill (1994),Drama,"In Providence's Italian neighborhood, Federal Hill, five young men face their choices as they become adults. Bobby, who's sort of dim, owes $30,000 to a counterfeiter who's demanding payment; he asks Ralph, a gifted cat burglar, to help and Ralph comes up with a plan. Later, Frank's dad, who is one of the Hill's top mobsters, wants to have a talk with Ralph about some of this plan. Meanwhile, Ralph's best friend Nicky falls hard for Wendy, a rich blond from Brown, and Nicky begins to imagine a future with her away from Providence. Ralph thinks Nicky's making a big mistake and sets out to prove it. When Ralph insults Frank's dad, things come to a head. —<jhailey@hotmail.com>",United States,English,Michael Corrente,1994,1 hour 37 minutes,"Rated R for strong language, some sexuality and drug content",,,
407,In the Mouth of Madness (1995),Horror|Thriller,"With the disappearance of hack horror writer Sutter Cane, all Hell is breaking loose...literally! Author Cane, it seems, has a knack for description that really brings his evil creepy-crawlies to life. Insurance investigator John Trent is sent to investigate Cane's mysterious vanishing act and ends up in the sleepy little East Coast town of Hobb's End. The fact that this town exists as a figment of Cane's twisted imagination is only the beginning of Trent's problems. —Tad Dibbern <DIBBERN_D@a1.mscf.upenn.edu>",United States,English,John Carpenter,1994,1 hour 35 minutes,15,,,
408,8 Seconds (1994),Drama,"This movie chronicles the life of Lane Frost, 1987 PRCA Bull Riding World Champion, his marriage and his friendships with Tuff Hedeman (three-time World Champion) and Cody Lambert. —Michael Crew <m.crew@bbcnc.org.uk>",United States,English,John G. Avildsen,1994,1 hour 45 minutes,15,,,
409,Above the Rim (1994),Crime|Drama,"Story of Kyle-Lee Watson, a promising high school basketball star, and his relationships with Birdie, a powerful drug dealer, and Birdie's brother, Thomas 'Shep' Sheppard, himself once a promising high school star at Kyle's school, now employed as a security guard. —<xDiezel21x@yahoo.com>",United States,English,Jeff Pollack,1994,1 hour 36 minutes,"Rated R for pervasive strong language, and for violence",,,
410,Addams Family Values (1993),Children|Comedy|Fantasy,"When an adorable baby boy is added to the Addams household, Wednesday and Pugsley do not hate him, they just aren't necessarily excited about his existence. OK...yeah, they do hate him. So they plot to get rid of him one way or another. Meanwhile, their parents hire a nanny for him and she charms Fester, but has evil intentions for him. The Addamses must stop her, but how?",United States,English,Barry Sonnenfeld,1993,1 hour 34 minutes,15,,,
412,"Age of Innocence, The (1993)",Drama,"Society scion Newland Archer is engaged to May Welland, but his well-ordered life is upset when he meets May's unconventional cousin, the Countess Olenska. At first, Newland becomes a defender of the Countess, whose separation from her abusive husband makes her a social outcast in the restrictive high society of late-19th Century New York, but he finds in her a kindred spirit and they fall in love. —Marg Baskin <marg@asd.raytheon.ca>",United States,"English, Italian, French",Martin Scorsese,1993,2 hours 19 minutes,12,,,
413,Airheads (1994),Comedy,"Three would be rockers Chazz, Rex and Pip, known as The Lone Rangers plan to play their demo on a recording company, but then they're turned down rudely. Then they decide to try the famous rock n' roll radio station, but are not accepted either. Then they decide arm themselves with squirt guns and take the station hostage for not playing their demo. But the three get more than what they have bargained for. —Emphinix",United States,English,Michael Lehmann,1994,1 hour 32 minutes,12,,,
414,"Air Up There, The (1994)",Comedy,"Jimmy Dolan is a college basketball coach who wants a big promotion. To get it, he needs to make a dramatic find. He ends up deep in Africa, hoping to recruit Saleh, a huge basketball prodigy Jimmy glimpsed in a home movie. But Saleh is the chief's son and has responsibilities at home, since the tribe's land is threatened by a mining company with its own hotshot basketball team. —Reid Gagle",United States,English,Paul Michael Glaser,1994,1 hour 47 minutes,All,,,
415,Another Stakeout (1993),Comedy|Thriller,"Chris and Bill are called upon for their excellent surveillance record to stakeout a lakeside home where a Mafia trial witness is believed to be heading or already hiding. Unlike their earlier _Stakeout_, this time they are accompanied by Gina Garret from the DA's office and her pet rottweiler 'Archie'; their cover, husband and wife with son Bill. —Rob Hartill",United States,English,John Badham,1993,1 hour 48 minutes,Rated PG-13 for two sequences of violence in a comic/action genre,,,
416,Bad Girls (1994),Western,"When saloon prostitute Cody Zamora rescues her friend Anita from an abusive customer by killing him, she is sentenced to hang. However, Anita and their two friends Eileen and Lilly rescue Cody and the four make a run for Texas, pursued by Graves and O'Brady, two Pinkerton detectives hired to track them. When Cody withdraws her savings from a Texas bank, the women believe they can now start a new life in Oregon. But Cody's old partner Kid Jarrett takes Cody's money when his gang robs the bank, and so the four so-called ""Honky-Tonk Harlots"" set out to recover the money, with the Pinkertons hot on their trail. —Jim Beaver <jumblejim@prodigy.net>",United States,"English, Spanish",Jonathan Kaplan,1994,1 hour 39 minutes,15,,,
417,Barcelona (1994),Comedy|Romance,"Ted, a stuffy white guy from Illinois working in sales for the Barcelona office of a US corporation, is paid an unexpected visit by his somewhat less stuffy cousin Fred, who is an officer in the US Navy. Over the next few months, both their lives are irrevocably altered by the events which follow Fred's arrival, events which are the trivial stuff of a comedy of manners at first but which gradually grow increasingly dramatic. —Tim Horrigan <horrigan@hanover-crrel.army.mil>",United States,"English, Spanish",Whit Stillman,1994,1 hour 41 minutes,Rated PG-13 for drug content and a brief sex scene,,,
418,Being Human (1993),Drama,"Five bittersweet vignettes that span the entire human history about five different men, all called Hector and played by the same actor (Robin Williams), who find themselves at a critical juncture in their lives. In prehistoric times, Hector lives in peace with his wife and their little son and daughter in a cave on a quite uninhabited island somewhere in the north. His world is shattered when a group of foreign pagan raiders led by a young chieftain and a somewhat pacifistic priest arrive there. In Ancient Rome, Hector is a loyal well-treated slave of Lucinnius, a somewhat naive big trader with political connections. When his latest shipment fails to arrive and the local corrupt governor Cyprion refuses to lend him money for his further endeavors due to bad omen that a professional soothsayer saw while reading the future from a chicken liver, he is ruined. To make things worse, just as Hector plans to ask his master for freedom and elope with his master's female African slave Thalia, Lucinnius informs him that they've been chosen to be scapegoats and must kill themselves under the governor's orders. In medieval times, Hector is a Scotsman who's traveling with a somewhat zealotic but friendly and well-intentioned priest on a mission of mercy to help the fallen crusaders, mortally wounded in the bloody skirmishes, make it to the other side in peace. Beatrice, a nice beautiful flirtatious Italian widow, is traveling part of the way with them as well. Hector is tired of death and carnage and wants to go home but when he and Beatrice connect despite not speaking each-others languages, he falls for her. The priest warns him that he can't handle her needs but Hector doesn't take his friendly warning seriously and eventually leaves with her. However, he soon realizes that the priest was referring to responsibilities of a complicated family life. During the Renaissance, a group of Portuguese nobleman and their servants and soldiers gets shipwrecked somewhere on the coast of Africa. They make an encampment at the beach and try to find some Africans to ask for help but they also try to uphold their strict old ways of life at their beach camp. The realities of the life and death situation they're in kick in quickly and things go wrong for most of them. Hector is one of the lower nobleman, who tries to reconnect with his lover, who wants nothing to do with him. However, Hector's misfortune turns out to be his blessing this time, if only temporarily. In present day New York, Hector is about to pick up his young daughter and little son he hasn't seen in years from his ex wife and her new husband and take them to a seaside bungalow where they can reconnect again. However, his day turns into a quagmire. First he gets blamed by the police for a bizarre accident that almost kills one of the tenants in a building owned by his somewhat sleazy partner Boris. Then Hector borrows the flower delivery car from his nice girlfriend Anna to get the kids but forgets to deliver the flowers which Anna's client ordered for a celebration. His kids don't make things much easier for him either. He decides to treat them like adults for a change and they have a redeeming serious talk about their uneasy relationship.",United Kingdom,"English, Gaelic",Bill Forsyth,1994,2 hours 2 minutes,15,,,
419,"Beverly Hillbillies, The (1993)",Comedy,"Jed Clampett and kin move from Arkansas to Beverly Hills, when he becomes a billionaire, after an oil strike. The country folk are very naive with regard to life in the big city, so when Jed starts a search for a new wife, there are inevitably plenty of takers and con artists ready to make a fast buck. —Rob Hartill",United States,English,Penelope Spheeris,1993,1 hour 32 minutes,12,,,
420,Beverly Hills Cop III (1994),Action|Comedy|Crime|Thriller,"After a botched attempt to make a bust in a Detroit chop shop, the effectively unorthodox police officer, Axel Foley, once more, finds himself in sunny Beverly Hills, hot on the trail of an elusive gang of cold-blooded killers. There--with the aid of old friends, Serge, the recently promoted Billy Rosewood, and his partner Jon Flint--Axel searches out the criminals' hideout which is nestled right under everyone's face: in Southern California's bustling theme park, WonderWorld. Now, all that's left to do is to convince the people and the police that the park's impeccable chief of security, Ellis DeWald, is a ruthless villain, and that the immaculate amusement park is, in reality, a graceful and impenetrable facade for a sinister operation. How hard can it be? —Nick Riganas",United States,"English, French",John Landis,1994,1 hour 44 minutes,15,,,
421,Black Beauty (1994),Adventure|Children|Drama,"Black Beauty, a beautiful black stallion in 1870s England, recalls his life from his birth through his carefree life as a colt to the many hardships he suffered after achieving maturity. He goes through many owners, both good and bad, until he finally finds happiness and contentment. —duke1029@aol.com",United Kingdom,English,Caroline Thompson,1994,1 hour 28 minutes,All,,,
422,Blink (1994),Thriller,"Emma is an attractive girl in her 20s who has been blind for 20 years. A new type of eye operation partially restores her sight, but she is having problems: sometimes she doesn't ""remember"" what she's seen until later. One night she is awakened by a commotion upstairs. Peering out of her door, she sees a shadowy figure descending the stairs. Convinced that her neighbour has been murdered she approaches the police, only to find that she is unsure if it was just her new eyes playing tricks on her. —Murray Chapman <muzzle@cs.uq.oz.au>",United States,English,Michael Apted,1993,1 hour 46 minutes,18,,,
423,Blown Away (1994),Action|Thriller,Jimmy Dove works for the bomb squad in Boston and he is always the one who is on the tough jobs. One day he decides to quit the force and to become a teacher for the rookies of the squad. A few days later his former partner is killed by a bomb and Jimmy becomes suspicious that maybe this bomb could have been built by a former friend of himself. He begins to investigate and finds out that his worst nightmare has returned from his past. —Harald Mayr <marvin@bike.augusta.de>,United States,"English, Irish Gaelic",Stephen Hopkins,1994,2 hours 1 minute,15,,,
424,Blue Chips (1994),Drama,"Pete Bell, a college basketball coach is under a lot of pressure. His team isn't winning and he cannot attract new players. The stars of the future are secretly being paid by boosters. This practice is forbidden in the college game, but Pete is desperate and has pressures from all around. —Rob Hartill",United States,English,William Friedkin,1994,1 hour 48 minutes,12,,,
425,Blue Sky (1994),Drama|Romance,"It's the early 1960s. Nuclear engineer Hank Marshall is a major in the US Army, he who works on top secret nuclear testing projects. Trouble follows him from posting to posting largely because of his mentally unstable wife, Carly Marshall, who is bipolar. During her manic phases, her already overt sexuality, which she models after such sex symbols as Marilyn Monroe and Brigitte Bardot, is ratcheted up a notch, that partying behavior which is mixed with less frequent phases of physically destructive behavior. Regardless, Hank and Carly love each other, Hank who would admit to himself that he enjoys the fact that other men find Carly attractive, which is partly why he allows her to act the way she does in public. In turn, they mutually love their now two teenaged daughters, Alex and Becky. Reassigned from their two year posting in Hawaii largely due to the ruckus Carly has caused there, they are next sent to Alabama, the base under the command of Vince Johnson, his wife, Vera Johnson, who heads the wives' welcoming committee. At an age of starting to test her own sexuality, Alex starts to date the Johnsons' son, Glenn. Due to no fault of his own, Hank faces some problems in the latest project on which he is working, code named Blue Sky. And Carly continues her regular behavior, which catches Vince's overtly wandering eye. These items in combination lead to the potential of the Marshalls' home life being pulled apart and Hank's career destroyed, both irreparably. —Huggo",United States,"English, French",Tony Richardson,1994,1 hour 41 minutes,15,,,
426,Body Snatchers (1993),Horror|Sci-Fi|Thriller,"In another retelling of the story by Jack Finney, Marti Malone's traveling with her dad on holiday. At a gas station, a soldier tells her to not sleep, because 'they' get you when you sleep. Once in the base, she and her father see people acting odd, and soon realise they're aliens. —Claudio Carvalho, Rio de Janeiro, Brazil",United States,English,Abel Ferrara,1993,1 hour 27 minutes,15,,,
427,Boxing Helena (1993),Drama|Mystery|Romance|Thriller,"A top surgeon is besotted with a beautiful woman who once ditched him. Unable to come to terms with life without her, he tries to convince her that they need each other. She has other ideas, but a horrific accident leaves her at his mercy. The plot is bizarre and perhaps sick at times, ending abruptly and with a twist. —Rob Hartill",United States,English,Jennifer Lynch,1993,1 hour 47 minutes,18,,,
428,"Bronx Tale, A (1993)",Drama,"The Bronx, New York, 1960. 9-year-old Calogero grows up admiring and fascinated by the local mob boss, Sonny. Calogero's father, Lorenzo, wants to have nothing to do with the mob and does his best to keep his son away from Sonny and mob business. However, it may prove a losing battle. —grantss",United States,"English, Italian",Robert De Niro,1993,2 hours 1 minute,Rated R for strong language and several scenes of violence,,,
429,Cabin Boy (1994),Comedy,"Snobby school boy goes left and mistakes the ""Filthy Whore"" for his millionaire dad's yacht. He joins four filthy fishermen for hijinx on the high seas. —Cary Pincus <pincus@aracor.com>",United States,English,Adam Resnick,1994,1 hour 20 minutes,Rated PG-13 for crude language,,,
430,Calendar Girl (1993),Comedy|Drama,"Like many adolescent boys, Roy Darpinian had the hots for movie divas, and one in particular was his wet dream as half of America's in the 1950s: Marilyn Monroe. The difference is, one summer holiday he actually decided to enlist his spineless buddies, Scott Foreman and Ned Bleuer, to actually drive all the way to Hollywood and make as many desperate attempts as it takes to meet her or get arrested trying, and no setback or embarrassment (even publicly bare-ass) can stop or distract him. Against all odds, he finally even got a chance to help her... —KGF Vissers",United States,English,John Whitesell,1993,1 hour 30 minutes,"Rated PG-13 for nudity, drug content and language",,,
431,Carlito's Way (1993),Crime|Drama,"A Puerto Rican ex-con pledges to stay away from his former drug dealing ways but finds himself being dragged back by his past connections and the naive machinations of his lawyer and best friend. Hoping to raise enough money to get away from New York, Carlito Brigante takes on the job of running a nightclub, renews an affair with a dancer but old associates and old instincts suck him back into a world of violence and mistrust. —Keith Loh <loh@sfu.ca>",United States,"English, Spanish, French",Brian De Palma,1993,2 hours 24 minutes,18,,,
432,City Slickers II: The Legend of Curly's Gold (1994),Adventure|Comedy|Western,"City Slickers II begins after the death of Curly. It is Mitch Robbins' 40th birthday and the day is going quite well, until he returns home (after a working at the radio station) and finds his brother Glen, the black sheep of the family, on his sofa. Mitch is about to have a nice birthday-night with his wife when he discovers a treasure map of Curly's by chance. Together with Phil (from the first film) and unfortunately also having to put up with Glen, he tries to find the hidden gold of Curly's father in the desert of Arizona instead of attending a meeting in Las Vegas. The adventurous journey reveals many surprises until everything seems to be over when the map gets lost. —Volker Boehm",United States,English,Paul Weiland,1994,1 hour 56 minutes,Rated PG-13 for a comic sex scene and off color humor,gold,treasure,sequel
433,Clean Slate (1994),Comedy,"Maurice L. Pogue (Dana Carvey) is a private eye with a problem: every morning when he wakes up, he has total amnesia, waking up with a ""clean slate"". Since he is in the middle of a hot investigation and has a developing romance, this is less than convenient. —Reid Gagle",United States,English,Mick Jackson,1994,1 hour 47 minutes,Rated PG-13 for language,,,
434,Cliffhanger (1993),Action|Adventure|Thriller,"Whilst crossing a ledge, 4000 feet above the earth, Gabe's friend's equipment fails to work and she slips out of his hand, falling to the ground. Almost a year later, Gabe is asked to go back to the same mountain range and rescue a group of 'stranded' people. The only catch is that these so called 'stranded' people are in fact looking for three boxes filled with $100,000,000 and they need a mountain ranger to lead them to them!! —Michael Feller <Reb@magna.com.au>",United States,English,Renny Harlin,1993,1 hour 53 minutes,15,,,
435,Coneheads (1993),Comedy|Sci-Fi,"An alien couple known as Beldar and Prymatt with cone-shaped heads from the planet called Remulak is mistakenly ditched on earth, during a scouting mission for planet conquest. While here, they dodge the INS, have a child and discover that life on Earth is quite good. But unfortunately they are being chased by the government who knows something is not quite right with the Conehead family. After they are rescued and taken back to their planet, Beldar vows to return to earth and conquer it. —Anthony Pereyra {hypersonic91@yahoo.com}",United States,English,Steve Barron,1993,1 hour 28 minutes,Rated PG for comic nudity and some double entendre humor,,,
436,Color of Night (1994),Drama|Thriller,"Psychologist gives up his practice when he unintentionally pushes a patient to commit suicide. In an effort to come to terms with this tragedy he visits an old colleague who is subsequently murdered. The quest to catch the killer centers around a group of psychologically disturbed patients, however equally as important is an affair which develops between himself and the mysterious Rose. —Anonymous",United States,English,Richard Rush,1994,2 hours 1 minute,18,,,
437,Cops and Robbersons (1994),Comedy,"When police discover that a mob hitman has moved in next door to the Robbersons, they want to find out what he is up to. So they set up a stakeout in the Robbersons' home. Hard-nosed, tough-as-nails Jake Stone is assigned to the stakeout. But now it's a question of whether Jake can last long enough to capture the bad guys. The Robbersons want to help so they are driving him crazy. —Brian W Martz <B.Martz@Genie.com>",United States,English,Michael Ritchie,1994,1 hour 33 minutes,"Rated PG for mild violence, language and some comic nudity",,,
438,"Cowboy Way, The (1994)",Action|Comedy|Drama,"Buddies Pepper Lewis (Woody Harrelson) and Sonny Gilstrap (Kiefer Sutherland) who are championship rodeo partners travel to New York to find their missing friend, Nacho Salazar Joaquín Martínez after he disappears in New York City to pick up his daughter, Theresa (Cara Buono). When Pepper and Sonny find that neither is anywhere to be found, they go about the wacky adventure of finding Nacho and Theresa, and in the process, test the foundation of their friendship. Along the way, they find themselves entwined in the inner workings of a New York sweat shop where Theresa has been enslaved after traveling to the U.S.A. from Cuba. Going about doing things in a cowboy way, Pepper and Sonny put their small town skills to the test in a big city kind of way and rescue Theresa from the thugs. —Chris Roybal <roybal@juno.com>",United States,English,Gregg Champion,1994,1 hour 42 minutes,15,,,
440,Dave (1993),Comedy|Romance,"Bill Mitchell is the philandering and distant President of the United States. Dave Kovic is a sweet-natured and caring Temp Agency operator, who by a staggering coincidence looks exactly like the President. As such, when Mitchell wants to escape an official luncheon, the Secret Service hires Dave to stand in for him. Unfortunately, Mitchell suffers a severe stroke whilst having sex with one of his aides, and Dave finds himself stuck in the role indefinitely. The corrupt and manipulative Chief of Staff, Bob Alexander, plans to use Dave to elevate himself to the White House - but unfortunately, he doesn't count on Dave enjoying himself in office, using his luck to make the country a better place, and falling in love with the beautiful First Lady... —Scott Nisbet <scott_nisbet@hotmail.com>",United States,"English, Spanish",Ivan Reitman,1993,1 hour 50 minutes,15,,,
441,Dazed and Confused (1993),Comedy,"It's the last day of school at a high school in a small town in Texas in 1976. The upperclassmen are hazing the incoming freshmen, and everyone is trying to get stoned, drunk, or laid, even the football players that signed a pledge not to. —Jon Reeves <jreeves@imdb.com>",United States,English,Richard Linklater,1993,1 hour 43 minutes,18,,,
442,Demolition Man (1993),Action|Adventure|Sci-Fi,"Frozen in 1996, Simon Phoenix, a convicted crime lord, is revived for a parole hearing well into the 21st century. Revived into a society free from crime, Phoenix resumes his murderous rampage, and no one can stop him. John Spartan, the police officer who captured Phoenix in 1996, has also been cryogenically frozen, this time for a crime he did not commit. In 2032, the former cities of Los Angeles, San Diego and Santa Barbara have merged into peaceful, utopian San Angeles. Unable to stop him with their non-violent solutions, the police release Spartan to help recapture Phoenix. Now after 36 years, Spartan has to adapt himself to the future society he has no knowledge about. —Rob Hartill",United States,English,Marco Brambilla,1993,1 hour 55 minutes,15,,,
